{"as_of":"2026-09-26T05:31:00Z","blocked_reason":"manager_missing","blocked_reasons":["manager_missing"],"data_state":"unavailable","entry_ready":null,"generation":{"process_instance_id":"process-a","profile_epoch":"profile-epoch","profile_revision":1},"manager_phase":null,"manager_stale_after_seconds":60,"manager_updated_at":null,"process_state":"running","profile_document_sha256":"e62d2004388c264bff64318981c6f473724225ff4b8f2072e9c7d747d534b4b9","profile_id":"ba1c039651aaa2774b94863629195135f8d9ae552e9a4e47aa939e9a3e044ee9","publication":{"hot_binding_tokens":500,"metadata_market_count":2048,"persistence_state":"running","phase_counts_authoritative":false,"publication_binding_tokens":500,"source_ready":true,"wire_sockets":1,"wire_tokens":4},"readiness_requires_status_and_full_sync":true,"resources":{"active_tokens":null,"component_token_limit":6,"draining_tokens":null,"hot_binding_count_semantics":"unique union of publication-bound and wire-owned token ids, including draining; cold metadata excluded","hot_binding_tokens":{"limit":null,"used":500},"metadata_market_count":2048,"phase_count_semantics":"mutually exclusive process-local binding phases; null on missing or inconsistent owner metrics; not a durable transaction ledger","phase_counts_authoritative":false,"prepared_tokens":null,"shared_token_count_semantics":"deduplicated token-id union across live component leases","wire_sockets":{"limit":null,"used":1},"wire_token_count_semantics":"unique token ids in active or retiring source shard jobs","wire_tokens":{"limit":null,"used":4}},"schema_version":"marketcow.btc-5m-management-health.v1","valid_until":null,"windows":[{"end_at":"2026-09-26T05:35:00Z","market_id":"4944030","profile_revision":1,"readiness_reason":"manager_missing","ready":false,"role":"current","start_at":"2026-09-26T05:30:00Z","window_id":"2026-09-26T05:30:00Z/2026-09-26T05:35:00Z"},{"end_at":"2026-09-26T05:40:00Z","market_id":"4944031","profile_revision":1,"readiness_reason":"manager_missing","ready":false,"role":"next","start_at":"2026-09-26T05:35:00Z","window_id":"2026-09-26T05:35:00Z/2026-09-26T05:40:00Z"}]}
